{
  "spec_version": "1.3.1",
  "run_id": "AR_V1_FULL200_20260708T014500Z_c7d41a2b",
  "batch_number": 1,
  "source_bank_hash": "40d35fd63ce38209455b389b18e52010d54ff7dcf4c9dc81e48a664d30288974",
  "output_prefix": "generated_items_all200",
  "row_count_expected": 200,
  "row_count_actual": 200,
  "unused_planned_ids": [],
  "schema_validation_pass": false,
  "answer_distribution_pass": true,
  "explanation_alignment_pass": true,
  "trap_alignment_pass": true,
  "status_permission_pass": true,
  "status_authority_pass": true,
  "id_range_pass": false,
  "manifest_alignment_pass": false,
  "source_safety_pass": true,
  "source_safety_notes": "Run validate_source_safety.py on exportable artifacts for full source-safety scan.",
  "near_copy_status_pass": true,
  "workbook_csv_parity_pass": true,
  "import_package_pass": true,
  "blocking_failures": [
    {
      "code": "MANIFEST_SCHEMA_FAILURE",
      "message": "'AR_V1_FULL200_20260708T014500Z_c7d41a2b' does not match '^AR_V1_B\\\\d{2,}_\\\\d{8}T\\\\d{6}Z_[a-f0-9]{8}$'",
      "severity": "blocking",
      "path": "../../data/runs/AR_V1_FULL200_20260708T014500Z_c7d41a2b/consolidated/manifest/run_manifest.json",
      "row": null
    },
    {
      "code": "CANONICAL_ID_OUT_OF_RANGE",
      "message": "AR_V1_B1_0001 outside manifest range AR_V1_B1_0001-AR_V1_B10_0020",
      "severity": "blocking",
      "path": "",
      "row": 2
    },
    {
      "code": "CANONICAL_ID_OUT_OF_RANGE",
      "message": "AR_V1_B1_0002 outside manifest range AR_V1_B1_0001-AR_V1_B10_0020",
      "severity": "blocking",
      "path": "",
      "row": 3
    },
    {
      "code": "CANONICAL_ID_OUT_OF_RANGE",
      "message": "AR_V1_B1_0003 outside manifest range AR_V1_B1_0001-AR_V1_B10_0020",
      "severity": "blocking",
      "path": "",
      "row": 4
    },
    {
      "code": "CANONICAL_ID_OUT_OF_RANGE",
      "message": "AR_V1_B1_0004 outside manifest range AR_V1_B1_0001-AR_V1_B10_0020",
      "severity": "blocking",
      "path": "",
      "row": 5
    },
    {
      "code": "CANONICAL_ID_OUT_OF_RANGE",
      "message": "AR_V1_B1_0005 outside manifest range AR_V1_B1_0001-AR_V1_B10_0020",
      "severity": "blocking",
      "path": "",
      "row": 6
    },
    {
      "code": "CANONICAL_ID_OUT_OF_RANGE",
      "message": "AR_V1_B1_0006 outside manifest range AR_V1_B1_0001-AR_V1_B10_0020",
      "severity": "blocking",
      "path": "",
      "row": 7
    },
    {
      "code": "CANONICAL_ID_OUT_OF_RANGE",
      "message": "AR_V1_B1_0007 outside manifest range AR_V1_B1_0001-AR_V1_B10_0020",
      "severity": "blocking",
      "path": "",
      "row": 8
    },
    {
      "code": "CANONICAL_ID_OUT_OF_RANGE",
      "message": "AR_V1_B1_0008 outside manifest range AR_V1_B1_0001-AR_V1_B10_0020",
      "severity": "blocking",
      "path": "",
      "row": 9
    },
    {
      "code": "CANONICAL_ID_OUT_OF_RANGE",
      "message": "AR_V1_B1_0009 outside manifest range AR_V1_B1_0001-AR_V1_B10_0020",
      "severity": "blocking",
      "path": "",
      "row": 10
    },
    {
      "code": "CANONICAL_ID_OUT_OF_RANGE",
      "message": "AR_V1_B1_0010 outside manifest range AR_V1_B1_0001-AR_V1_B10_0020",
      "severity": "blocking",
      "path": "",
      "row": 11
    },
    {
      "code": "CANONICAL_ID_OUT_OF_RANGE",
      "message": "AR_V1_B1_0011 outside manifest range AR_V1_B1_0001-AR_V1_B10_0020",
      "severity": "blocking",
      "path": "",
      "row": 12
    },
    {
      "code": "CANONICAL_ID_OUT_OF_RANGE",
      "message": "AR_V1_B1_0012 outside manifest range AR_V1_B1_0001-AR_V1_B10_0020",
      "severity": "blocking",
      "path": "",
      "row": 13
    },
    {
      "code": "CANONICAL_ID_OUT_OF_RANGE",
      "message": "AR_V1_B1_0013 outside manifest range AR_V1_B1_0001-AR_V1_B10_0020",
      "severity": "blocking",
      "path": "",
      "row": 14
    },
    {
      "code": "CANONICAL_ID_OUT_OF_RANGE",
      "message": "AR_V1_B1_0014 outside manifest range AR_V1_B1_0001-AR_V1_B10_0020",
      "severity": "blocking",
      "path": "",
      "row": 15
    },
    {
      "code": "CANONICAL_ID_OUT_OF_RANGE",
      "message": "AR_V1_B1_0015 outside manifest range AR_V1_B1_0001-AR_V1_B10_0020",
      "severity": "blocking",
      "path": "",
      "row": 16
    },
    {
      "code": "CANONICAL_ID_OUT_OF_RANGE",
      "message": "AR_V1_B1_0016 outside manifest range AR_V1_B1_0001-AR_V1_B10_0020",
      "severity": "blocking",
      "path": "",
      "row": 17
    },
    {
      "code": "CANONICAL_ID_OUT_OF_RANGE",
      "message": "AR_V1_B1_0017 outside manifest range AR_V1_B1_0001-AR_V1_B10_0020",
      "severity": "blocking",
      "path": "",
      "row": 18
    },
    {
      "code": "CANONICAL_ID_OUT_OF_RANGE",
      "message": "AR_V1_B1_0018 outside manifest range AR_V1_B1_0001-AR_V1_B10_0020",
      "severity": "blocking",
      "path": "",
      "row": 19
    },
    {
      "code": "CANONICAL_ID_OUT_OF_RANGE",
      "message": "AR_V1_B1_0019 outside manifest range AR_V1_B1_0001-AR_V1_B10_0020",
      "severity": "blocking",
      "path": "",
      "row": 20
    },
    {
      "code": "CANONICAL_ID_OUT_OF_RANGE",
      "message": "AR_V1_B1_0020 outside manifest range AR_V1_B1_0001-AR_V1_B10_0020",
      "severity": "blocking",
      "path": "",
      "row": 21
    },
    {
      "code": "CANONICAL_ID_OUT_OF_RANGE",
      "message": "AR_V1_B2_0001 outside manifest range AR_V1_B1_0001-AR_V1_B10_0020",
      "severity": "blocking",
      "path": "",
      "row": 22
    },
    {
      "code": "CANONICAL_ID_OUT_OF_RANGE",
      "message": "AR_V1_B2_0002 outside manifest range AR_V1_B1_0001-AR_V1_B10_0020",
      "severity": "blocking",
      "path": "",
      "row": 23
    },
    {
      "code": "CANONICAL_ID_OUT_OF_RANGE",
      "message": "AR_V1_B2_0003 outside manifest range AR_V1_B1_0001-AR_V1_B10_0020",
      "severity": "blocking",
      "path": "",
      "row": 24
    },
    {
      "code": "CANONICAL_ID_OUT_OF_RANGE",
      "message": "AR_V1_B2_0004 outside manifest range AR_V1_B1_0001-AR_V1_B10_0020",
      "severity": "blocking",
      "path": "",
      "row": 25
    },
    {
      "code": "CANONICAL_ID_OUT_OF_RANGE",
      "message": "AR_V1_B2_0005 outside manifest range AR_V1_B1_0001-AR_V1_B10_0020",
      "severity": "blocking",
      "path": "",
      "row": 26
    },
    {
      "code": "CANONICAL_ID_OUT_OF_RANGE",
      "message": "AR_V1_B2_0006 outside manifest range AR_V1_B1_0001-AR_V1_B10_0020",
      "severity": "blocking",
      "path": "",
      "row": 27
    },
    {
      "code": "CANONICAL_ID_OUT_OF_RANGE",
      "message": "AR_V1_B2_0007 outside manifest range AR_V1_B1_0001-AR_V1_B10_0020",
      "severity": "blocking",
      "path": "",
      "row": 28
    },
    {
      "code": "CANONICAL_ID_OUT_OF_RANGE",
      "message": "AR_V1_B2_0008 outside manifest range AR_V1_B1_0001-AR_V1_B10_0020",
      "severity": "blocking",
      "path": "",
      "row": 29
    },
    {
      "code": "CANONICAL_ID_OUT_OF_RANGE",
      "message": "AR_V1_B2_0009 outside manifest range AR_V1_B1_0001-AR_V1_B10_0020",
      "severity": "blocking",
      "path": "",
      "row": 30
    },
    {
      "code": "CANONICAL_ID_OUT_OF_RANGE",
      "message": "AR_V1_B2_0010 outside manifest range AR_V1_B1_0001-AR_V1_B10_0020",
      "severity": "blocking",
      "path": "",
      "row": 31
    },
    {
      "code": "CANONICAL_ID_OUT_OF_RANGE",
      "message": "AR_V1_B2_0011 outside manifest range AR_V1_B1_0001-AR_V1_B10_0020",
      "severity": "blocking",
      "path": "",
      "row": 32
    },
    {
      "code": "CANONICAL_ID_OUT_OF_RANGE",
      "message": "AR_V1_B2_0012 outside manifest range AR_V1_B1_0001-AR_V1_B10_0020",
      "severity": "blocking",
      "path": "",
      "row": 33
    },
    {
      "code": "CANONICAL_ID_OUT_OF_RANGE",
      "message": "AR_V1_B2_0013 outside manifest range AR_V1_B1_0001-AR_V1_B10_0020",
      "severity": "blocking",
      "path": "",
      "row": 34
    },
    {
      "code": "CANONICAL_ID_OUT_OF_RANGE",
      "message": "AR_V1_B2_0014 outside manifest range AR_V1_B1_0001-AR_V1_B10_0020",
      "severity": "blocking",
      "path": "",
      "row": 35
    },
    {
      "code": "CANONICAL_ID_OUT_OF_RANGE",
      "message": "AR_V1_B2_0015 outside manifest range AR_V1_B1_0001-AR_V1_B10_0020",
      "severity": "blocking",
      "path": "",
      "row": 36
    },
    {
      "code": "CANONICAL_ID_OUT_OF_RANGE",
      "message": "AR_V1_B2_0016 outside manifest range AR_V1_B1_0001-AR_V1_B10_0020",
      "severity": "blocking",
      "path": "",
      "row": 37
    },
    {
      "code": "CANONICAL_ID_OUT_OF_RANGE",
      "message": "AR_V1_B2_0017 outside manifest range AR_V1_B1_0001-AR_V1_B10_0020",
      "severity": "blocking",
      "path": "",
      "row": 38
    },
    {
      "code": "CANONICAL_ID_OUT_OF_RANGE",
      "message": "AR_V1_B2_0018 outside manifest range AR_V1_B1_0001-AR_V1_B10_0020",
      "severity": "blocking",
      "path": "",
      "row": 39
    },
    {
      "code": "CANONICAL_ID_OUT_OF_RANGE",
      "message": "AR_V1_B2_0019 outside manifest range AR_V1_B1_0001-AR_V1_B10_0020",
      "severity": "blocking",
      "path": "",
      "row": 40
    },
    {
      "code": "CANONICAL_ID_OUT_OF_RANGE",
      "message": "AR_V1_B2_0020 outside manifest range AR_V1_B1_0001-AR_V1_B10_0020",
      "severity": "blocking",
      "path": "",
      "row": 41
    },
    {
      "code": "CANONICAL_ID_OUT_OF_RANGE",
      "message": "AR_V1_B3_0001 outside manifest range AR_V1_B1_0001-AR_V1_B10_0020",
      "severity": "blocking",
      "path": "",
      "row": 42
    },
    {
      "code": "CANONICAL_ID_OUT_OF_RANGE",
      "message": "AR_V1_B3_0002 outside manifest range AR_V1_B1_0001-AR_V1_B10_0020",
      "severity": "blocking",
      "path": "",
      "row": 43
    },
    {
      "code": "CANONICAL_ID_OUT_OF_RANGE",
      "message": "AR_V1_B3_0003 outside manifest range AR_V1_B1_0001-AR_V1_B10_0020",